{"$schema":"https://json-schema.org/draft/2020-12/schema","$id":"https://example.local/schemas/taxonomy/taxonomy-approval.schema.json","type":"object","additionalProperties":false,"required":["approval_schema_version","proposal_version","source_inventory_sha256","proposal_sha256","status","mass_annotation_allowed","class_decisions","case_decisions","owner_signoff"],"properties":{"approval_schema_version":{"const":"1.0.0"},"proposal_version":{"type":"string"},"source_inventory_sha256":{"type":"string","pattern":"^[0-9a-f]{64}$"},"proposal_sha256":{"type":"string","pattern":"^[0-9a-f]{64}$"},"status":{"enum":["draft","approved"]},"mass_annotation_allowed":{"const":false},"class_decisions":{"type":"array","items":{"$ref":"#/$defs/classDecision"}},"case_decisions":{"type":"array","items":{"$ref":"#/$defs/caseDecision"}},"owner_signoff":{"anyOf":[{"type":"null"},{"$ref":"#/$defs/signoff"}]}},"$defs":{"nullableText":{"type":["string","null"]},"classDecision":{"type":"object","additionalProperties":false,"required":["class_id","decision","final_class_ids","approved_attributes","approved_ports","approved_value_set_refs","matching_critical_fields","notes"],"properties":{"class_id":{"type":"string"},"decision":{"enum":[null,"approve","revise","reject","split","merge"]},"final_class_ids":{"type":"array","uniqueItems":true,"items":{"type":"string"}},"approved_attributes":{"type":"array","uniqueItems":true,"items":{"type":"string"}},"approved_ports":{"type":"array","uniqueItems":true,"items":{"type":"string"}},"approved_value_set_refs":{"type":"array","uniqueItems":true,"items":{"type":"string"}},"matching_critical_fields":{"type":"array","uniqueItems":true,"items":{"type":"string"}},"notes":{"$ref":"#/$defs/nullableText"}}},"caseDecision":{"type":"object","additionalProperties":false,"required":["case_id","decision","selected_option_ids","notes"],"properties":{"case_id":{"type":"string"},"decision":{"enum":[null,"select_option","create_new_class","mark_unsupported","mark_non_product","data_error","defer"]},"selected_option_ids":{"type":"array","uniqueItems":true,"items":{"type":"string"}},"notes":{"$ref":"#/$defs/nullableText"}}},"signoff":{"type":"object","additionalProperties":false,"required":["owner","approved_at","proposal_sha256","notes"],"properties":{"owner":{"type":"string","minLength":1},"approved_at":{"type":"string","format":"date"},"proposal_sha256":{"type":"string","pattern":"^[0-9a-f]{64}$"},"notes":{"$ref":"#/$defs/nullableText"}}}}}
