{
  "approval_schema_version": "1.0.0",
  "case_decisions": [
    {
      "case_id": "case:0000000000000001",
      "decision": null,
      "notes": null,
      "selected_option_ids": []
    },
    {
      "case_id": "case:0000000000000002",
      "decision": null,
      "notes": null,
      "selected_option_ids": []
    },
    {
      "case_id": "case:0000000000000003",
      "decision": null,
      "notes": null,
      "selected_option_ids": []
    },
    {
      "case_id": "case:0000000000000004",
      "decision": null,
      "notes": null,
      "selected_option_ids": []
    },
    {
      "case_id": "case:0000000000000005",
      "decision": null,
      "notes": null,
      "selected_option_ids": []
    },
    {
      "case_id": "case:0000000000000006",
      "decision": null,
      "notes": null,
      "selected_option_ids": []
    },
    {
      "case_id": "case:0000000000000007",
      "decision": null,
      "notes": null,
      "selected_option_ids": []
    },
    {
      "case_id": "case:0000000000000008",
      "decision": null,
      "notes": null,
      "selected_option_ids": []
    },
    {
      "case_id": "case:0000000000000009",
      "decision": null,
      "notes": null,
      "selected_option_ids": []
    },
    {
      "case_id": "case:000000000000000a",
      "decision": null,
      "notes": null,
      "selected_option_ids": []
    },
    {
      "case_id": "case:000000000000000b",
      "decision": null,
      "notes": null,
      "selected_option_ids": []
    },
    {
      "case_id": "case:000000000000000c",
      "decision": null,
      "notes": null,
      "selected_option_ids": []
    },
    {
      "case_id": "case:000000000000000d",
      "decision": null,
      "notes": null,
      "selected_option_ids": []
    },
    {
      "case_id": "case:000000000000000e",
      "decision": null,
      "notes": null,
      "selected_option_ids": []
    },
    {
      "case_id": "case:000000000000000f",
      "decision": null,
      "notes": null,
      "selected_option_ids": []
    },
    {
      "case_id": "case:0000000000000010",
      "decision": null,
      "notes": null,
      "selected_option_ids": []
    },
    {
      "case_id": "case:0000000000000011",
      "decision": null,
      "notes": null,
      "selected_option_ids": []
    },
    {
      "case_id": "case:0000000000000012",
      "decision": null,
      "notes": null,
      "selected_option_ids": []
    },
    {
      "case_id": "case:0000000000000013",
      "decision": null,
      "notes": null,
      "selected_option_ids": []
    },
    {
      "case_id": "case:0000000000000014",
      "decision": null,
      "notes": null,
      "selected_option_ids": []
    },
    {
      "case_id": "case:0000000000000015",
      "decision": null,
      "notes": null,
      "selected_option_ids": []
    },
    {
      "case_id": "case:0000000000000016",
      "decision": null,
      "notes": null,
      "selected_option_ids": []
    },
    {
      "case_id": "case:0000000000000017",
      "decision": null,
      "notes": null,
      "selected_option_ids": []
    },
    {
      "case_id": "case:0000000000000018",
      "decision": null,
      "notes": null,
      "selected_option_ids": []
    },
    {
      "case_id": "case:0000000000000019",
      "decision": null,
      "notes": null,
      "selected_option_ids": []
    },
    {
      "case_id": "case:000000000000001a",
      "decision": null,
      "notes": null,
      "selected_option_ids": []
    },
    {
      "case_id": "case:000000000000001b",
      "decision": null,
      "notes": null,
      "selected_option_ids": []
    },
    {
      "case_id": "case:000000000000001c",
      "decision": null,
      "notes": null,
      "selected_option_ids": []
    },
    {
      "case_id": "case:000000000000001d",
      "decision": null,
      "notes": null,
      "selected_option_ids": []
    },
    {
      "case_id": "case:000000000000001e",
      "decision": null,
      "notes": null,
      "selected_option_ids": []
    },
    {
      "case_id": "case:000000000000001f",
      "decision": null,
      "notes": null,
      "selected_option_ids": []
    },
    {
      "case_id": "case:0000000000000020",
      "decision": null,
      "notes": null,
      "selected_option_ids": []
    },
    {
      "case_id": "case:0000000000000021",
      "decision": null,
      "notes": null,
      "selected_option_ids": []
    },
    {
      "case_id": "case:0000000000000022",
      "decision": null,
      "notes": null,
      "selected_option_ids": []
    },
    {
      "case_id": "case:0000000000000023",
      "decision": null,
      "notes": null,
      "selected_option_ids": []
    },
    {
      "case_id": "case:0000000000000024",
      "decision": null,
      "notes": null,
      "selected_option_ids": []
    },
    {
      "case_id": "case:0000000000000025",
      "decision": null,
      "notes": null,
      "selected_option_ids": []
    },
    {
      "case_id": "case:0000000000000026",
      "decision": null,
      "notes": null,
      "selected_option_ids": []
    },
    {
      "case_id": "case:0000000000000027",
      "decision": null,
      "notes": null,
      "selected_option_ids": []
    },
    {
      "case_id": "case:0000000000000028",
      "decision": null,
      "notes": null,
      "selected_option_ids": []
    },
    {
      "case_id": "case:0000000000000029",
      "decision": null,
      "notes": null,
      "selected_option_ids": []
    },
    {
      "case_id": "case:000000000000002a",
      "decision": null,
      "notes": null,
      "selected_option_ids": []
    },
    {
      "case_id": "case:000000000000002b",
      "decision": null,
      "notes": null,
      "selected_option_ids": []
    },
    {
      "case_id": "case:000000000000002c",
      "decision": null,
      "notes": null,
      "selected_option_ids": []
    },
    {
      "case_id": "case:000000000000002d",
      "decision": null,
      "notes": null,
      "selected_option_ids": []
    },
    {
      "case_id": "case:000000000000002e",
      "decision": null,
      "notes": null,
      "selected_option_ids": []
    },
    {
      "case_id": "case:000000000000002f",
      "decision": null,
      "notes": null,
      "selected_option_ids": []
    },
    {
      "case_id": "case:0000000000000030",
      "decision": null,
      "notes": null,
      "selected_option_ids": []
    },
    {
      "case_id": "case:0000000000000031",
      "decision": null,
      "notes": null,
      "selected_option_ids": []
    },
    {
      "case_id": "case:0000000000000032",
      "decision": null,
      "notes": null,
      "selected_option_ids": []
    },
    {
      "case_id": "case:0000000000000033",
      "decision": null,
      "notes": null,
      "selected_option_ids": []
    },
    {
      "case_id": "case:0000000000000034",
      "decision": null,
      "notes": null,
      "selected_option_ids": []
    },
    {
      "case_id": "case:0000000000000035",
      "decision": null,
      "notes": null,
      "selected_option_ids": []
    },
    {
      "case_id": "case:0000000000000036",
      "decision": null,
      "notes": null,
      "selected_option_ids": []
    },
    {
      "case_id": "case:0000000000000037",
      "decision": null,
      "notes": null,
      "selected_option_ids": []
    },
    {
      "case_id": "case:0000000000000038",
      "decision": null,
      "notes": null,
      "selected_option_ids": []
    },
    {
      "case_id": "case:0000000000000039",
      "decision": null,
      "notes": null,
      "selected_option_ids": []
    },
    {
      "case_id": "case:000000000000003a",
      "decision": null,
      "notes": null,
      "selected_option_ids": []
    },
    {
      "case_id": "case:000000000000003b",
      "decision": null,
      "notes": null,
      "selected_option_ids": []
    },
    {
      "case_id": "case:000000000000003c",
      "decision": null,
      "notes": null,
      "selected_option_ids": []
    },
    {
      "case_id": "case:000000000000003d",
      "decision": null,
      "notes": null,
      "selected_option_ids": []
    },
    {
      "case_id": "case:000000000000003e",
      "decision": null,
      "notes": null,
      "selected_option_ids": []
    },
    {
      "case_id": "case:000000000000003f",
      "decision": null,
      "notes": null,
      "selected_option_ids": []
    },
    {
      "case_id": "case:0000000000000040",
      "decision": null,
      "notes": null,
      "selected_option_ids": []
    },
    {
      "case_id": "case:0000000000000041",
      "decision": null,
      "notes": null,
      "selected_option_ids": []
    },
    {
      "case_id": "case:0000000000000042",
      "decision": null,
      "notes": null,
      "selected_option_ids": []
    },
    {
      "case_id": "case:0000000000000043",
      "decision": null,
      "notes": null,
      "selected_option_ids": []
    },
    {
      "case_id": "case:0000000000000044",
      "decision": null,
      "notes": null,
      "selected_option_ids": []
    },
    {
      "case_id": "case:0000000000000045",
      "decision": null,
      "notes": null,
      "selected_option_ids": []
    },
    {
      "case_id": "case:0000000000000046",
      "decision": null,
      "notes": null,
      "selected_option_ids": []
    },
    {
      "case_id": "case:0000000000000047",
      "decision": null,
      "notes": null,
      "selected_option_ids": []
    },
    {
      "case_id": "case:0000000000000048",
      "decision": null,
      "notes": null,
      "selected_option_ids": []
    },
    {
      "case_id": "case:0000000000000049",
      "decision": null,
      "notes": null,
      "selected_option_ids": []
    },
    {
      "case_id": "case:000000000000004a",
      "decision": null,
      "notes": null,
      "selected_option_ids": []
    },
    {
      "case_id": "case:000000000000004b",
      "decision": null,
      "notes": null,
      "selected_option_ids": []
    },
    {